{
  "id": "0192cae6-0006-7000-8000-000000000000",
  "session_trace_id": "0192cae6-0005-7000-8000-000000000000",
  "parent_span_id": "0123456789abcdef",
  "tool_id": "audit-harness:escape-scan",
  "tool_version": "0.3.0",
  "args": { "staged": true },
  "args_hash": "1717171717171717171717171717171717171717171717171717171717171717",
  "result_summary": { "exit_code": 0 },
  "result_hash": "2828282828282828282828282828282828282828282828282828282828282828",
  "result_storage_key": null,
  "invoked_at": "2026-05-17T00:00:00Z",
  "latency_ms": 350,
  "cost_record_ref": "0192cae6-0009-7000-8000-000000000000",
  "error": null,
  "retry_attempt": 0
}
